treatment_name,category,cancer_types,side_effects,duration,effectiveness,cost_range
Chemotherapy,Systemic Therapy,"Breast, Lung, Colorectal, Ovarian","Nausea, Hair loss, Fatigue, Low blood counts",3-6 months,60-80%,"$10,000-$100,000"
Radiation Therapy,Local Therapy,"Breast, Lung, Prostate, Brain","Skin irritation, Fatigue, Local pain",5-7 weeks,70-90%,"$15,000-$50,000"
Surgery,Local Therapy,"Breast, Lung, Prostate, Colorectal","Pain, Infection risk, Scarring",1-3 weeks recovery,80-95%,"$20,000-$100,000"
Immunotherapy,Targeted Therapy,"Lung, Melanoma, Kidney, Bladder","Flu-like symptoms, Skin rash, Diarrhea",6-12 months,20-50%,"$50,000-$200,000"
Hormone Therapy,Targeted Therapy,"Breast, Prostate","Hot flashes, Mood changes, Bone loss",5-10 years,70-85%,"$5,000-$30,000"
